user_input,retrieved_contexts,response,reference,context_recall,faithfulness,answer_relevancy,context_precision
"Factoid question: What is the theme of Regulatory Theme 3.5 in the 2024/2025 Regulatory Agenda?
Answer: Reavaliação da autorização de uso do aditivo alimentar dióxido de titânio em alimentos.",['1.5. Procedimentos para autorização de uso de aditivos alimentares e coadjuvantes \nde tecnologia  \n \nTema Regulatório 3.5 da Agenda Regulatória 2024/2025: Reavaliação da autorização de uso do aditivo  \nalimentar dióxido de titânio em alimentos.'],"I don't know, apologies.",Reavaliação da autorização de uso do aditivo alimentar dióxido de titânio em alimentos.,1.0,0.0,0.0,0.9999999999
"Factoid question: What sector does the Anvisa coordinate, supervise, and control activities in?
Answer: In the sector of foods","['No setor de alimentos, a Anvisa coordena, supervisiona e controla as atividades de registro, inspeção, \nfiscalização e controle de riscos, sendo responsável por estabelecer normas e padrões de qualidade e \nidentidade a serem observados.']","In the sector of foods, Anvisa coordinates, supervises, and controls activities related to registration, inspection, monitoring, and risk control.",In the sector of foods,1.0,1.0,0.7989041785973048,0.9999999999
"Factoid question: What is the law that mandates the iodization of salt for human consumption?
Answer: Lei 6.150/1974 – Dispõe sobre a obrigatoriedade da iodação do sal, destinado ao consumo humano, seu controle pelos órgãos sanitários e dá outras providências","['Lei 6.150/1974 – Dispõe sobre a obrigatoriedade da iodação do sal, destinado ao consumo humano, seu \ncontrole pelos órgãos sanitários e dá outras providências']",Lei 6.150/1974 mandates the iodization of salt for human consumption.,"Lei 6.150/1974 – Dispõe sobre a obrigatoriedade da iodação do sal, destinado ao consumo humano, seu controle pelos órgãos sanitários e dá outras providências",1.0,1.0,0.5328699481594167,0.9999999999
"Factoid question: When was the Biblioteca de Alimentos last updated?
Answer: Atualizada em 06.11.2024",['BIBLIOTECA DE \nALIMENTOS \nAtualizada em 06.11.2024 \nCoordenação de Processos Regulatórios – CPROR \nAssessoria de Melhoria da Qualidade Regulatória – ASREG \nGabinete do Diretor-Presidente \n \nAGENDA REGULATÓRIA \nCiclo Bienal \n2024-2025'],The Biblioteca de Alimentos was last updated on 06.11.2024.,Atualizada em 06.11.2024,1.0,1.0,0.8271143977447125,0.9999999999
"Factoid question: What is the theme of the regulatory agenda 2024/2025 related to contaminants in food?
Answer: Theme Regulatório 3.17 da Agenda Regulatória 2024/2025: Revisão da regulamentação de contaminantes em alimentos.",['IN 297/2024 \nIN 303/2024 \nIN 306/2024 \n1.6. Contaminantes em alimentos \n \nTema Regulatório 3.17 da Agenda Regulatória 2024/2025: Revisão da regulamentação de contaminantes em \nalimentos.'],The theme of the regulatory agenda 2024/2025 related to contaminants in food is the review of regulations on contaminants in food.,Theme Regulatório 3.17 da Agenda Regulatória 2024/2025: Revisão da regulamentação de contaminantes em alimentos.,1.0,1.0,0.8490940183355736,0.9999999999
"Factoid question: What is the regulation number that prohibits the importation, manufacturing, distribution, and commercialization of foods and beverages containing Aloe Vera in the entire national territory?
Answer: RE 5052/2011","['crescimento, e complementos de ferro. \nAlterada por:  \nRDC 770/2022 \n \nRE 5052/2011 – Proibir a importação, a fabricação, a distribuição e a comercialização, em todo território nacional, \nde alimentos e bebidas à base de Aloe Vera.']","I don't know, apologies.",RE 5052/2011,1.0,0.0,0.0,0.9999999999
"Factoid question: What law obliges products to inform about the presence of gluten as a preventive measure for celiac disease?
Answer: Lei 10.674/2003","['de 2003. \n \nLei 10.674/2003  – Obriga a que os produtos alimentícios comercializados informem sobre a presença de \nglúten, como medida preventiva e de controle da doença celíaca.']",Lei 10.674/2003.,Lei 10.674/2003,1.0,1.0,0.0,0.9999999999
"Factoid question: What is the theme of Regulatory Topic 3.33 in the 2024/2025 Regulatory Agenda?
Answer: Atualização periódica da lista de LMR, IDA, DRfA para IFA de medicamentos veterinários em alimentos de origem animal.","['1.8. Resíduos de medicamentos veterinários em alimentos de origem animal \n \nTema Regulatório 3.33 da Agenda Regulatória 2024/2025: Atualização periódica da lista de LMR, IDA, DRfA']","I don't know, apologies.","Atualização periódica da lista de LMR, IDA, DRfA para IFA de medicamentos veterinários em alimentos de origem animal.",1.0,0.0,0.0,0.9999999999
"Factoid question: What are the procedures for regularização de alimentos?
Answer: Procedimentos para regularização de alimentos","['1. Regularização, avaliação de risco e padrões de alimentos \nLei 9.782/1999 – Define o Sistema Nacional de Vigilância Sanitária, cria a Agência Nacional de Vigilância \nSanitária, e dá outras providências.']","I'm sorry, I don't have the specific procedures for regularização de alimentos from the provided context.",Procedimentos para regularização de alimentos,1.0,1.0,0.0,0.0
"Factoid question: What RDC established the requirements for the safety and health benefits of probiotics for use in food?
Answer: RDC 241/2018",['RDC 241/2018 – Requisitos para comprovação da segurança e dos benefícios à saúde dos probióticos para uso \nem alimentos. \nAlterada por: \nRDC 839/2023  - Comprovação de segurança e autorização de uso de novos alimentos e novos \ningredientes.'],RDC 241/2018,RDC 241/2018,1.0,,0.5955460434161973,0.9999999999
"Factoid question: What is the document related to the restriction of the use of industrial trans fats in foods?

Answer: Perguntas e Respostas – Requisitos para uso de Gorduras Trans Industriais em Alimentos.",['RDC 632/2022 - Restrição de uso de gorduras trans industriais em alimentos.  \nDocumento relacionado: \nPerguntas e Respostas – Requisitos para uso de Gorduras Trans Industriais em Alimentos.'],Perguntas e Respostas – Requisitos para uso de Gorduras Trans Industriais em Alimentos.,Perguntas e Respostas – Requisitos para uso de Gorduras Trans Industriais em Alimentos.,1.0,1.0,0.6320769391863043,0.9999999999
"Factoid question: What is the document related to modificações na composição de alimentos padronizados para alegações nutricionais?

Answer: Perguntas e respostas sobre modificações na composição de alimentos padronizados para alegações nutricionais.",['Alterada por: \nRDC 839/2023  - Comprovação de segurança e autorização de uso de novos alimentos e novos \ningredientes. \nDocumento relacionado: \nPerguntas e respostas sobre modificações na composição de alimentos padronizados para alegações'],Perguntas e respostas sobre modificações na composição de alimentos padronizados para alegações nutricionais.,Perguntas e respostas sobre modificações na composição de alimentos padronizados para alegações nutricionais.,1.0,0.0,0.3300133360591986,0.9999999999
"Factoid question: What is the document related to ""Perguntas e Respostas sobre Materiais em contato com alimentos""?

Answer: RDC 91/2001 – Critérios gerais e classificação de materiais para embalagens em contato com alimentos",['RDC 91/2001 – Critérios gerais e classificação de materiais para embalagens em contato com alimentos \nDocumento relacionado: \nPerguntas e Respostas sobre Materiais em contato com alimentos'],RDC 91/2001 – Critérios gerais e classificação de materiais para embalagens em contato com alimentos.,RDC 91/2001 – Critérios gerais e classificação de materiais para embalagens em contato com alimentos,1.0,1.0,0.47572954686969343,0.9999999999
"Factoid question: What document provides guidelines for good nutritional practices for French bread?
Answer: Guia de boas práticas nutricionais para pão francês","['Guia nº 16, versão 1, de 05/10/2018 - Guia para Determinação de Prazos de Validade de Alimentos. \n Documentos relacionados: \nPerguntas e respostas sobre rotulagem de alimentos alergênicos \nPerguntas e respostas sobre rotulagem de lactose']","I'm sorry, I don't know the answer.",Guia de boas práticas nutricionais para pão francês,1.0,0.0,0.0,0.0
"Factoid question: What decree establishes the basic rules on food in Brazil?
Answer: Decreto-Lei 986/1969","['Sanitária, e dá outras providências. \n \nDecreto-Lei 986/1969 – Institui normas básicas sobre alimentos \n \nRDC 204/2005 – Procedimento de petições submetidas à análise pelos setores técnicos da Anvisa \nAlterada por: \nRDC 23/2015 \nRDC 208/2018']",Decreto-Lei 986/1969 establishes the basic rules on food in Brazil.,Decreto-Lei 986/1969,1.0,1.0,0.6746470004285138,0.9999999999
